Term (EN),Equivalent (JP),Definition (EN),Context/Example (EN),Section,File
Case Definition,ケース定義,A case definition is a kind of calculation definition (see 7.19 ) that produces a result intended to achieve a specific objective regarding a given subject.,"A case is a general concept that may be used in its own right, but also provides the basis for more specific kinds of cases, including analysis cases (see 7.23 ), verification cases (see 7.24 ), and use cases (see 7.25 ).",7.22.1,SysML2
Case Usage,ケース使用,A case usage is a kind of calculation usage that is a usage of a case definition.,"A case is a general concept that may be used in its own right, but also provides the basis for more specific kinds of cases, including analysis cases (see 7.23 ), verification cases (see 7.24 ), and use cases (see 7.25 ).",7.22.1,SysML2
subject (of a case),(ケースの)主題,"The subject of a case is modeled as a distinguished parameter, similarly to the subject of a requirement (see 7.21 ).",case def FaultRecovery { subject system : AutomationSystem; actor engineer : Person; objective { doc /* The engineer determines the cause of the system fault and resolves it returning the system to nominal operation. */ } },7.22.1,SysML2
objective (of a case),(ケースの)目的,The objective of a case is modeled as a requirement usage to be satisfied by the performance of the case.,case def FaultRecovery { subject system : AutomationSystem; actor engineer : Person; objective { doc /* The engineer determines the cause of the system fault and resolves it returning the system to nominal operation. */ } },7.22.1,SysML2
actor parameter (of a case),(ケースの)アクターパラメータ,A case definition or usage may also have one or more actor parameters that represent roles played by an entity external to the subject of the case but necessary to the specification of the case.,A case definition or usage may also have one or more actor parameters that represent roles played by an entity external to the subject of the case but necessary to the specification of the case.,7.22.1,SysML2
case (keyword),ケース (キーワード),"A case definition or usage is declared as a kind of calculation definition or usage (see 7.19.2 ), using the kind keyword case.",use case def UseCaseDef1 { subject s1:Subject1; objective { doc /* This is the objective description. */ require requirement1; } },7.22.2,SysML2
subject (keyword),主題 (キーワード),"Instead, the keyword subject is used to identify the declaration of a subject parameter, which must come before the declaration of any other parameters in a case definition or usage.",case def FaultRecovery { subject system : AutomationSystem; actor engineer : Person; objective { doc /* The engineer determines the cause of the system fault and resolves it returning the system to nominal operation. */ } },7.22.2,SysML2
actor (keyword),アクター (キーワード),"Similarly to the declaration of a subject parameter, these distinguished parameters are declared using the keyword actor rather than explicitly declaring their direction.",case def FaultRecovery { subject system : AutomationSystem; actor engineer : Person; objective { doc /* The engineer determines the cause of the system fault and resolves it returning the system to nominal operation. */ } },7.22.2,SysML2
Cases model library,ケースモデルライブラリ,The base case definition and usage for are Case and cases from the Cases model library (see 9.2.15 ).,The base case definition and usage for are Case and cases from the Cases model library (see 9.2.15 ).,7.22.1,SysML2
